{
  "$schema": "../inlay.schema.prototype.json",
  "formatVersion": 1,
  "game": "minecraft",
  "versionId": "1.0.0",
  "name": "Lucent Optimisations",
  "summary": "A parentless optimisation Layer.",
  "files": [
    {
      "path": "config/sodium-options.json",
      "hashes": {
        "sha1": "26367c14b20dacf8081248c7af85aa9a4db1d6d9",
        "sha256": "1315c92fb7261972160132d42b1ce71e8f51c1a064dc485432b048f16e1321ec"
      },
      "downloads": [
        "./prototypes/manifest/fixtures/sodium-options.json"
      ],
      "fileSize": 56
    },
    {
      "path": "resourcepacks/lucent/pack.mcmeta",
      "hashes": {
        "sha1": "12824dd941192c13f58d42ebdfd5b760c3c241ec",
        "sha256": "b7b33b0da467563b7ae91cbaf1496d60bbd2b66f80ac6156438c0863a3972970"
      },
      "env": {
        "client": "required",
        "server": "unsupported"
      },
      "downloads": [
        "./prototypes/manifest/fixtures/lucent-pack.mcmeta"
      ],
      "fileSize": 91
    },
    {
      "path": "config/remote-sodium-options.json",
      "hashes": {
        "sha1": "26367c14b20dacf8081248c7af85aa9a4db1d6d9",
        "sha512": "9c1e9f689302dd6f79cf9fc2dbb16ecdab7ee6459440bc3caac4a9ffab95c791f19b144233b587f2d67caa408bbed1ad65b1b00a52772c5ed6e56d7390081ff5"
      },
      "downloads": [
        "https://raw.githubusercontent.com/lucent-mc/inlay/f656faf91294da52855e7916c8975a89d7fffa23/prototypes/manifest/fixtures/sodium-options.json"
      ],
      "fileSize": 56
    }
  ],
  "dependencies": {
    "minecraft": "1.21.1",
    "fabric-loader": "0.16.14"
  }
}
