{
  "$schema": "../inlay.schema.prototype.json",
  "extends": {
    "url": "https://raw.githubusercontent.com/lucent-mc/inlay/f0eba65f30b90f9d3982011142594670bc2cd331/prototypes/manifest/fixtures/parent-inlay.index.json",
    "hashes": {
      "sha1": "2f1464b4dd1e868d5a7cc585ce87d14bd0cfa53f",
      "sha256": "95a63a6a43bf39d5df8abc46c2835648a86e5be962c55f0ce326f602d768fbda"
    },
    "fileSize": 805
  },
  "formatVersion": 1,
  "game": "minecraft",
  "versionId": "0.1.0",
  "name": "Unpublished Tuning Layer",
  "summary": "A valid buildable Layer whose Pack has not been published.",
  "files": [
    {
      "path": "config/internal-tuning.json",
      "hashes": {
        "sha1": "89deb8da04aa0b838d5d6c791d4b7d14ea68c52b",
        "sha256": "2bfc3dbece592897a8d33447082e56ec6559f07fed50173e7df089fa3ff6b040"
      },
      "downloads": [
        "./prototypes/manifest/fixtures/internal-tuning.json"
      ],
      "fileSize": 27
    }
  ],
  "dependencies": {
    "minecraft": "1.21.1",
    "fabric-loader": "0.16.14"
  }
}
