{
  "$schema": "../inlay.schema.prototype.json",
  "extends": {
    "url": "https://raw.githubusercontent.com/lucent-mc/inlay/6a9fc7fb0ac9a2e26fb5af8e3ec9bb59dde756fc/prototypes/manifest/fixtures/parent-inlay.index.json",
    "hashes": {
      "sha1": "ce4f2afe9e45dfbac16c06cbd6a5050a291637d9",
      "sha256": "6f765550a9d62a5c57e2a3d1a9381cfa5da5064771e8dbe72a209788fdbe52fd"
    },
    "fileSize": 253
  },
  "formatVersion": 1,
  "game": "minecraft",
  "versionId": "0.1.0",
  "name": "Internal Tuning Layer",
  "summary": "A valid Layer with no distribution target.",
  "files": [
    {
      "path": "config/internal-tuning.json",
      "hashes": {
        "sha1": "89deb8da04aa0b838d5d6c791d4b7d14ea68c52b",
        "sha256": "2bfc3dbece592897a8d33447082e56ec6559f07fed50173e7df089fa3ff6b040"
      },
      "downloads": [
        "./prototypes/manifest/fixtures/internal-tuning.json"
      ],
      "fileSize": 27
    }
  ],
  "dependencies": {
    "minecraft": "1.21.1",
    "fabric-loader": "0.16.14"
  }
}
